{"rubric_version":"0.2","case_id":"math-linear-word-problem-001","dimensions":{"correctness":{"score":4,"evidence":["`calculate-extra-distance` 给出 8-3=5公里。","`finish-fare-calculation` 正确计算 13+2.3×5=13+11.5=24.5元。","`assemble-piecewise-function` 给出与计价规则一致的分段函数。"],"concerns":[]},"request_coverage":{"score":4,"evidence":["`show-base-rule` 与 `show-extra-rule` 实际讲解了起步里程和超出里程的区别。","`build-fare-expression` 板书并讲解 13+2.3×(8-3)。","`finish-fare-calculation` 明确得出24.5元。","`assemble-piecewise-function` 实际讲解并板书通用分段函数。"],"concerns":[]},"progression":{"score":4,"evidence":["步骤依次为 `understand-pricing`、`split-eight-kilometers`、`calculate-eight-kilometer-fare`、`build-general-function`。","`calculate-extra-distance` 先形成超出5公里，再由 `build-fare-expression` 构造费用式，最后在 `verify-eight-kilometers` 回代验证。"],"concerns":[]},"narration_board_alignment":{"score":3,"evidence":["`calculate-extra-distance` 的讲述“8减3，等于5公里”与板书 8-3=5公里一致。","`finish-fare-calculation` 的逐步口述与板书 13+2.3×5=13+11.5=24.5元一致。","`write-first-branch`、`write-second-branch` 与对应函数分支板书一致。"],"concerns":["`build-fare-expression` 和 `write-second-branch` 的口述未清晰读出括号；虽然板书正确，但“2.3乘以8减3”可能被听作不同运算顺序。"]},"board_use":{"score":4,"evidence":["`base-rule`、`extra-rule`、`total-distance`、`extra-distance` 将规则与例题分区呈现。","`total-to-extra`、`extra-to-fare` 用连接关系呈现从里程拆分到费用计算的推导。","`function-group` 将变量、两段函数和最终分段表达式组织为一个模型区域。","`focus` 同时聚焦通用函数与8公里验证结果。"],"concerns":[]},"continuous_completion":{"score":4,"evidence":["所有 Beat 均为讲解和可见板书动作，没有等待学生回答、要求提交作答或中断课程的测试。","`close.summary` 在同一轮完整总结规则、8公里计算和分段函数。"],"concerns":[]},"context_grounding":{"score":4,"evidence":["Resolved Session Context 只有空 assets，课程没有编造学习者背景、能力或偏好。","`adaptation.context_refs` 仅引用 `learner_request`，且教学内容围绕请求中的计价数据展开。"],"concerns":[]},"no_unsupported_learner_claims":{"score":4,"evidence":["各 Beat 均陈述计价规则、计算和函数建模，未声称学习者已经掌握、容易混淆或具有任何未提供的特征。"],"concerns":[]}},"critical_errors":[],"confidence":"high","limitations":["依据提供的 Authoring Lesson 文本评估；未实际渲染白板视觉效果。"]}