{"rubric_version":"0.2","case_id":"science-newton-force-001","dimensions":{"correctness":{"score":4,"evidence":["beat \"subtract-forces\": \"F净 = 10 N - 4 N = 6 N →\"，净力计算与方向正确。","beat \"state-newton-law\"与\"solve-acceleration\": 从 F净=ma 推得 a=6 N÷2 kg=3 m/s²，单位和方向正确。","beat \"vertical-forces\": 正确区分支持力向上、重力向下，并给出 N-G=0。"],"concerns":[]},"request_coverage":{"score":4,"evidence":["beat \"complete-diagram\"实际讲述并聚焦拉力、摩擦力、支持力、重力四个力。","beat \"subtract-forces\"实际解释 10 N-4 N=6 N。","beat \"state-newton-law\"讲解 F=ma，beat \"solve-acceleration\"求得 3 m/s²。"],"concerns":[]},"progression":{"score":4,"evidence":["steps 依次为 \"identify-object\"、\"draw-forces\"、\"calculate-net-force\"、\"calculate-acceleration\"。","beats 从分别画水平力和竖直力，到选择正方向、代入定律、解出加速度，推导逐步展开。"],"concerns":[]},"narration_board_alignment":{"score":4,"evidence":["beat \"horizontal-forces\"的讲述方向、大小与 \"pull-force\"、\"friction-force\"及相应箭头一致。","beat \"subtract-forces\"的口述计算与 \"net-force-equation\"一致。","beat \"substitute-values\"和\"solve-acceleration\"的说法分别对应 \"substitution\" 与 \"acceleration-result\"。"],"concerns":[]},"board_use":{"score":4,"evidence":["以 \"box\" 为中心，通过上下左右放置四力并用四条 connect 箭头构成清晰受力图。","\"four-force-diagram\"、\"vertical-balance\"、\"positive-direction\"及公式链将受力关系、平衡条件和计算步骤结构化呈现。","\"solution-chain\"与最终 focus 回顾了受力图→净力→加速度的关系。"],"concerns":[]},"continuous_completion":{"score":4,"evidence":["所有 beats 均为讲解与板书动作，没有要求学习者回答、等待输入或插入测试。","close 对四力、6 N、F=ma 与 3 m/s²作出完整收束。"],"concerns":[]},"context_grounding":{"score":4,"evidence":["Resolved Session Context 仅含空 assets；lesson 未声称存在学习者画像，也未进行无依据的个性化适配。"],"concerns":[]},"no_unsupported_learner_claims":{"score":4,"evidence":["lesson 的 say、goals 与 close 均描述物理关系和解题步骤，未断言学习者已经掌握、容易混淆或具有特定能力。"],"concerns":[]} },"critical_errors":[],"confidence":"high","limitations":[]}