{"rubric_version":"0.2","case_id":"language-english-passive-001","dimensions":{"correctness":{"score":4,"evidence":["beat-passive-pattern：准确讲解一般过去时被动结构“was/were + 过去分词”。","beat-choose-was：根据单数主语 The meal 正确选择 was。","beat-participle：正确说明规则动词 cook 的过去式和过去分词均为 cooked。","beat-final-sentence：完整答案“The meal was cooked by the chef.”正确。"],"concerns":[]},"request_coverage":{"score":4,"evidence":["beat-object-first：明确教授宾语 the meal 提前并成为被动句主语。","beat-passive-pattern 与 beat-participle：实际讲解“was/were + 过去分词”及本句 was cooked 的构成。","beat-by-optional：明确说明 by 短语可保留或省略。","beat-final-sentence：呈现并解释“The meal was cooked by the chef.”。"],"concerns":[]},"progression":{"score":4,"evidence":["step-analyze 先在 beat-parts 拆分主语、谓语、宾语。","step-promote-object 在 beat-object-first 先完成宾语提升并解释关注点变化。","step-build-verb 依次建立结构、选择 was、确定 cooked，最后在 beat-assemble 合成为完整句。"],"concerns":[]},"narration_board_alignment":{"score":4,"evidence":["beat-parts 的讲述与 active-parts 表格逐项对应句子成分和作用。","beat-object-first 的讲述与 passive-subject 文本、object-promotion 连线一致。","beat-by-optional 的讲述与 optional-by 板书同时展示保留和省略两种形式。","beat-final-sentence 的讲述与 final-passive 及 complete-transformation 连线一致。"],"concerns":[]},"board_use":{"score":4,"evidence":["active-parts 用表格结构化呈现主语、谓语、宾语及其作用。","object-promotion、pattern-application、agent-move 用连线呈现成分转换关系。","assembly 用分块图示标注完整被动句的三个组成部分。","beat-summary-board 使用三步归纳、分组和 focus 聚焦结论。"],"concerns":[]},"continuous_completion":{"score":4,"evidence":["课程从 beat-source 到 beat-summary-board 连续完成分析、变换、合成与总结。","全程没有要求学习者回答、等待输入或插入测试题；close 给出完整可独立理解的总结。"],"concerns":[]},"context_grounding":{"score":4,"evidence":["Resolved Session Context 仅含 assets，未提供学习者画像。","lesson.adaptation.context_refs 引用 learner_request，且策略“始终围绕同一个例句逐步变换”与请求中的指定例句直接相关。"],"concerns":[]},"no_unsupported_learner_claims":{"score":4,"evidence":["所有 beat 均在讲解语法与例句，没有声称学习者已经掌握、容易出错或具有未提供的背景。","close 只总结所教内容，未对学习者能力作无证据判断。"],"concerns":[]}},"critical_errors":[],"confidence":"high","limitations":[]}