{"rubric_version":"0.2","case_id":"computing-binary-search-001","dimensions":{"correctness":{"score":4,"evidence":["trace/round-one：12<23 后将 low 更新为 4，排除下标 0..3，推导正确。","trace/round-two：mid=5 且 array[5]=23，正确定位下标 5。","ordering/ordered-reason 与 complexity/log-result：有序性推理及 O(log n) 推导正确。"],"concerns":[]},"request_coverage":{"score":4,"evidence":["setup/define-bounds：实际讲解 low、mid、high 的含义、初始值和计算式。","trace/table-header、round-one、round-two：以逐轮表格展示比较、排除和找到 23。","ordering/ordered-reason、unordered-failure：解释有序性如何保证排除方向及无序时为何失效。","complexity/halving、log-result：实际说明逐轮减半和 O(log n)。"],"concerns":[]},"progression":{"score":4,"evidence":["setup 先建立数组、下标和边界定义，再进入 trace。","trace/round-one 先完成一次排除，round-two 在缩小后的范围内找到目标。","ordering 与 complexity 在具体轨迹后分别抽象出有序性原因和对数复杂度。"],"concerns":[]},"narration_board_alignment":{"score":4,"evidence":["trace/round-one 的 say 与 round-one-row、round-one-range 都呈现 12<23、排除 0..3、low=4。","trace/round-two 的 say 与 round-two-row、found-result 都呈现 mid=5、找到下标 5。","complexity/log-result 的 say 与 complexity-result 都呈现减半推导和 O(log n)。"],"concerns":[]},"board_use":{"score":4,"evidence":["setup/show-array 用下标—元素表格建立可操作的数组表示。","trace/table-header 至 round-two-row 构成逐轮状态表，并配合 remaining-range 图示突出排除结果。","ordering/order-guarantee 和 unordered-warning 用关系图及对照说明排除方向的依据。","complexity/halving-chain 与 complexity-result 以缩减链和公式连接具体过程与复杂度。"],"concerns":[]},"continuous_completion":{"score":4,"evidence":["所有 beats 均为讲解、写入、强调或聚焦动作，没有等待学习者回答的动作。","close/summary 连续复述两轮状态、有序性理由和 O(log n)，完成本轮教学闭环。"],"concerns":[]},"context_grounding":{"score":4,"evidence":["Resolved Session Context 仅含空 assets，lesson 未虚构学习者背景、能力或偏好。","lesson 采用与请求直接相关的通用讲解路径，未作无依据的个性化断言。"],"concerns":[]},"no_unsupported_learner_claims":{"score":4,"evidence":["全文仅陈述算法步骤、数组状态和复杂度，没有断言学习者已理解、会犯某种错误或具备特定能力。","close/summary 是内容总结，不包含对学习者掌握程度的无证据判断。"],"concerns":[]}},"critical_errors":[],"confidence":"high","limitations":[]}