{"rubric_version":"0.2","case_id":"calibration-defect-interruption","dimensions":{"correctness":{"score":4,"evidence":["Beat `conserve-charge` correctly relates equal current in an unbranched steady circuit to no charge accumulation.","Beat `state-equality` states the closed-circuit result `I₁=I₂`.","Beat `whole-circuit-zero` correctly concludes an open series path gives `I₁=I₂=0`."],"concerns":[]},"request_coverage":{"score":4,"evidence":["Beat `show-circuit` displays `asset-circuit-001` and references its controlled regions for battery, lamps A/B, and wire.","Beat `identify-path` explicitly teaches that the series circuit has one path and no branches.","Beat `state-equality` explicitly teaches `I₁=I₂`.","Beats `introduce-break` through `generalize-break` teach that any break makes the whole circuit have no current."],"concerns":[]},"progression":{"score":4,"evidence":["The lesson progresses from identifying the supplied circuit (`show-circuit`, `identify-path`) to defining currents (`mark-currents`), explaining conservation (`conserve-charge`), then deriving `I₁=I₂` (`state-equality`).","The open-circuit explanation proceeds from a concrete break at lamp A (`introduce-break`) to the whole-circuit consequence (`whole-circuit-zero`) and general rule (`generalize-break`)."],"concerns":[]},"narration_board_alignment":{"score":4,"evidence":["`identify-path` narration about the battery–A–B–battery route matches the `single-path` diagram sequence and no-branch statement.","`state-equality` narration matches the `equal-current` board expression and its closed-loop condition.","`whole-circuit-zero` narration matches `zero-current` showing `I₁=I₂=0` and both lamps off.","`compare-states` narration matches the `state-comparison` table."],"concerns":[]},"board_use":{"score":4,"evidence":["The lesson uses the provided image with region-level references in `circuit-image`, then builds a spatially related `single-path` diagram.","`charge-rule` → `equal-current` visually represents the explanatory relationship rather than merely repeating prose.","The open-circuit causal chain (`open-at-a`, `zero-current`, `open-rule`) and final `state-comparison` table organize both states clearly."],"concerns":[]},"continuous_completion":{"score":0,"evidence":["Beat `compare-states` says: `讲到这里先停下，请你回答为什么两灯电流相同；你回答后我再继续。`"],"concerns":["The lesson explicitly pauses for learner output and promises further continuation, so it does not complete in one uninterrupted teaching round."]},"context_grounding":{"score":4,"evidence":["Beat `show-circuit` directly uses the uploaded `asset-circuit-001` and its controlled regions.","The lesson addresses the exact requested circuit phenomena: equal series current and the consequence of one lamp opening."],"concerns":[]},"no_unsupported_learner_claims":{"score":4,"evidence":["The lesson makes no claims about the learner's prior knowledge, ability, misconceptions, or performance.","The only learner-directed statement in `compare-states` is a prompt to answer, not an unsupported judgment about the learner."],"concerns":[]}},"critical_errors":[{"severity":"major","category":"pedagogy","description":"The lesson violates the required one-round continuous-completion constraint by stopping for a learner answer and stating that it will continue only afterward.","evidence":"Beat `compare-states`: `讲到这里先停下，请你回答为什么两灯电流相同；你回答后我再继续。`"}],"confidence":"high","limitations":[]}