{"rubric_version":"0.2","case_id":"language-argument-structure-001","dimensions":{"correctness":{"score":4,"evidence":["beat-distinction 准确区分理由回答“为什么”、证据回答“凭什么”。","beat-response 采用“承认合理顾虑—限定主张—维护观点”的有效回应反方方式。","beat-structure-map 正确呈现证据→理由→观点，以及反方与回应的论证关系。"],"concerns":[]},"request_coverage":{"score":4,"evidence":["beat-claim-definition 实际定义并示范中心观点。","beat-distinction 至 beat-evidence-one 实际讲解理由与证据的功能区别及支撑关系。","beat-counterargument 与 beat-response 实际示范呈现、承认并回应反方。","beat-structure-map 提供包含观点、两组理由与证据、反方和回应的结构关系图。"],"concerns":[]},"progression":{"score":4,"evidence":["课程从 beat-topic 的整体论证链开始，再依次展开观点、理由与证据、反方回应，最后在 beat-structure-map 汇总。","beat-reason-one 明确指出理由仍需证据，beat-evidence-one 随后补上对应证据，形成逐层建构。","beat-writing-order 将结构图进一步转化为成文顺序。"],"concerns":[]},"narration_board_alignment":{"score":4,"evidence":["beat-distinction 的口述定义与 reason-definition、evidence-definition 板书一致。","beat-response 的“承认—回应—维护限定”与 response-concession、response-rebuttal 及两条连接关系一致。","beat-structure-map 的口述关系与 structure-map 的节点和 relations 一一对应。"],"concerns":[]},"board_use":{"score":4,"evidence":["argument-chain 先建立总览，避免板书成为孤立文本。","reason-evidence-definitions 以并列分组突出比较关系，并用连接线表达证据支撑理由、理由支持观点。","structure-map 用独立 summary_board 汇总完整关系，writing-order 表将结构转成文章位置与任务。"],"concerns":[]},"continuous_completion":{"score":4,"evidence":["全部 beats 均为连续讲解与板书动作，没有等待学生回答的指令。","close 对观点、理由、证据、反方回应及其关系作出完整收束。"],"concerns":[]},"context_grounding":{"score":4,"evidence":["lesson.adaptation.context_refs 明确引用 learner_request。","beat-topic 至 beat-writing-order 始终围绕请求指定的“中学生是否应该每天运动”话题展开。"],"concerns":[]},"no_unsupported_learner_claims":{"score":4,"evidence":["课程没有声称学习者具备、缺少或已经掌握任何能力。","lesson.adaptation 仅说明围绕请求话题采用的教学策略，未虚构学习者画像。"],"concerns":[]}},"critical_errors":[],"confidence":"high","limitations":[]}