{"rubric_version":"0.2","case_id":"language-poem-imagery-001","dimensions":{"correctness":{"score":4,"evidence":["beat-autumn-images：从“枯、老、昏”推到衰败、暗淡的秋景。","beat-atmosphere-builds：将三组意象组织为“看见归宿、却仍在荒凉路上”的处境。","beat-heartbroken-traveler：以“昏鸦”“人家”与“断肠人在天涯”说明反衬关系。"],"concerns":[]},"request_coverage":{"score":4,"evidence":["beat-autumn-images、beat-home-images、beat-travel-images：逐组列出并解释关键意象。","beat-atmosphere-builds：实际讲解意象按顺序叠加成整体氛围。","beat-heartbroken-traveler：实际讲解“断肠人”与可归的昏鸦、人家的对照。","beat-evidence-chain：明确呈现“文本证据→效果→情感”的推导链。"],"concerns":[]},"progression":{"score":4,"evidence":["step-images 先辨认两组景物及特征，step-road 再补入旅途处境。","beat-atmosphere-builds 先综合环境，随后 beat-sunset 与 beat-heartbroken-traveler 才揭示人物和对照。","beat-evidence-chain 最后收束为完整证据链，而非一开始直接给主题。"],"concerns":[]},"narration_board_alignment":{"score":4,"evidence":["beat-autumn-images 的说解对应三个意象板书、分组“萧瑟的秋景”和强调动作。","beat-atmosphere-builds 的说解对应两条组间连接及 combined-atmosphere 图示。","beat-heartbroken-traveler 的对照说解对应 crow-traveler-contrast、home-traveler-contrast 与 contrast-result。","beat-evidence-chain 的说解与 evidence-chain 分阶段图示一致。"],"concerns":[]},"board_use":{"score":4,"evidence":["三组意象分别以 imagery-cluster 分组，并标注“萧瑟的秋景”“可归宿的生活图景”“寒凉而疲惫的旅途”。","bleak-to-home、home-to-travel 可视化呈现意象组合的顺序与关系。","evidence-chain 使用独立 summary-board，将文本、效果和情感组织为结构化推导。"],"concerns":[]},"continuous_completion":{"score":4,"evidence":["全部内容按四个 step 连续讲完，并以 close.summary 收束。","各 Beat 均为讲解与板书动作，没有等待学生作答、要求输出或插入测试。"],"concerns":[]},"context_grounding":{"score":4,"evidence":["Resolved Session Context 仅有 assets，未提供学习者画像；课程没有虚构能力、偏好或经历。","adaptation.context_refs 指向 learner_request，且实际采用“按文本顺序逐层累积意象”的请求匹配策略。"],"concerns":[]},"no_unsupported_learner_claims":{"score":4,"evidence":["全课使用文本分析表述，如“支持我们读出”，未声称学生已经理解、不会理解或具有特定水平。","close.summary 仍以文本证据的推导为中心，没有对学习者作无依据判断。"],"concerns":[]}},"critical_errors":[],"confidence":"high","limitations":[]}