{"rubric_version":"0.2","case_id":"math-probability-tree-001","dimensions":{"correctness":{"score":4,"evidence":["beat after-red：正确说明取红后剩1红1蓝，第二次两分支均为1/2。","beat after-blue：正确说明取走唯一蓝球后，第二次取红概率为1、取蓝概率为0。","beat add-paths：正确计算1/3+1/3=2/3。"],"concerns":[]},"request_coverage":{"score":4,"evidence":["beats first-red、first-blue：实际绘制第一次红、蓝概率树分支。","beats after-red、after-blue：讲解并标出不放回后第二次分支概率变化。","beat mark-different：明确颜色不同对应“红→蓝和蓝→红”。","beat add-paths：实际得出两次颜色不同的概率为2/3。"],"concerns":[]},"progression":{"score":4,"evidence":["steps setup→first-draw→second-draw 先给出球的组成，再逐层建立树。","steps select-paths→calculate 先筛选有利路径，再分别相乘、最后相加。","beat calculate-red-blue 与 calculate-blue-red 将两条路径分开计算。"],"concerns":[]},"narration_board_alignment":{"score":4,"evidence":["beat first-red：讲述2/3，action first-red-branch 标注“红：2/3”。","beat after-blue：讲述第二次红为1、蓝为0，对应 blue-red-branch 与 blue-blue-branch。","beat add-paths：讲述互斥路径相加，action final-answer 写出完整加法。"],"concerns":[]},"board_use":{"score":4,"evidence":["actions 以 start 为根、第一层结果节点和第二层叶节点构成清晰的两层概率树。","beats after-red、after-blue 使用 remaining-state 注释并聚焦比较剩余球组成。","beat mark-different 用 group 与 highlight 标出两条有利路径；beat add-paths 将结论单独强调。"],"concerns":[]},"continuous_completion":{"score":4,"evidence":["全部内容在连续 beats 中完成，close 总结完整方法与答案。","lesson 中没有要求等待学生回答、暂停互动或输出测试题。"],"concerns":[]},"context_grounding":{"score":4,"evidence":["Resolved Session Context 仅含空 assets；lesson 未声称任何不存在的学习者背景、能力或偏好。","教学语言与 learner_request 的 zh-CN 一致。"],"concerns":[]},"no_unsupported_learner_claims":{"score":4,"evidence":["各 beat 均陈述题目条件、概率推导或教学指令，没有对学习者掌握程度作无证据判断。","close 仅总结解法，没有声称学习者已经理解或完成。"],"concerns":[]}},"critical_errors":[],"confidence":"high","limitations":[]}