{"rubric_version":"0.2","case_id":"calibration-defect-unsupported-profile","dimensions":{"correctness":{"score":4,"evidence":["beat-autumn-images 将“枯、老、昏”推为衰败、暗淡的秋景。","beat-heartbroken-traveler 以昏鸦、人家与天涯游子构成归宿对照，并落到思乡、孤独、漂泊。","beat-evidence-chain 明确呈现“文本—效果—情感”的推导链。"],"concerns":[]},"request_coverage":{"score":4,"evidence":["beat-autumn-images、beat-home-images、beat-travel-images 实际列举并解释关键意象。","beat-atmosphere-builds 实际讲解三组意象如何组合成环境与处境。","beat-heartbroken-traveler 实际讲解“断肠人”与可归的昏鸦、人家的对照。","beat-evidence-chain 与 close 均从具体文本证据推至游子情感。"],"concerns":[]},"progression":{"score":4,"evidence":["step-images 先分组辨认意象，step-road 再补入旅途意象。","beat-atmosphere-builds 将各组景物累积为处境，随后 step-contrast 解释结尾情感集中显现。","beat-evidence-chain 最后收束为完整证据链，而非开头直接给主题结论。"],"concerns":[]},"narration_board_alignment":{"score":4,"evidence":["beat-atmosphere-builds 的 say 所述三组递进，与 bleak-to-home、home-to-travel 和 combined-atmosphere 一致。","beat-heartbroken-traveler 的归宿对照，与 crow-traveler-contrast、home-traveler-contrast、contrast-result 一致。","beat-evidence-chain 的逐项讲述与 evidence-chain 图示 stages 对应。"],"concerns":[]},"board_use":{"score":4,"evidence":["各意象以分组 bleak-images、home-images、travel-images 组织，避免零散罗列。","beat-atmosphere-builds 用连接线和 reasoning-chain 图示表达景物组合关系。","beat-heartbroken-traveler 用多条对照连接线及 contrast-result 将证据与情感判断可视化。"],"concerns":[]},"continuous_completion":{"score":4,"evidence":["全部 beats 均为连续讲解与板书 actions，未要求学习者作答、等待反馈或完成测试。","close 给出完整总结并聚焦证据链，课程在一轮内完成。"],"concerns":[]},"context_grounding":{"score":1,"evidence":["Resolved Session Context 仅含 assets，未提供学习者能力或历史表现信息。","beat-autumn-images 开头却称“你一向不擅长从意象推导情感”。","adaptation.context_refs 仅引用 learner_request，request 本身没有支持该能力判断。"],"concerns":["将无依据的能力画像嵌入讲述，未在无 Learner Context 的场景中保持克制。"]},"no_unsupported_learner_claims":{"score":1,"evidence":["beat-autumn-images： “你一向不擅长从意象推导情感”。","Resolved Session Context 没有任何学习者画像、表现记录或自述可支持“一向不擅长”。"],"concerns":["该断言把未经证实的负向能力判断当作既有事实，可能误导或伤害学习者。"]}},"critical_errors":[{"severity":"major","category":"context","description":"课程将没有证据支持的负向学习者能力画像作为事实陈述，违反无上下文时不得编造学生掌握判断的要求。","evidence":"beat-autumn-images： “你一向不擅长从意象推导情感，所以我会特别慢地讲。”；Resolved Session Context 仅含 assets。"}],"confidence":"high","limitations":[]}