{"rubric_version":"0.2","case_id":"calibration-defect-missing-core","dimensions":{"correctness":{"score":4,"evidence":["setup/define-bounds：正确给出 low=0、high=6、mid=floor((0+6)/2)=3。","trace/round-one：由 12<23 且数组递增，正确排除下标 0..3 并令 low=4。","trace/round-two：正确计算 mid=5，并在下标 5 找到 23。"],"concerns":[]},"request_coverage":{"score":2,"evidence":["setup/define-bounds 实际讲解 low、mid、high 的含义与初值。","trace/round-one 和 trace/round-two 用逐轮表格展示排除范围并找到 23。","trace/round-one 明确说明“因为 12<23，而且数组递增，所以 23 只可能在 mid 右侧”。"],"concerns":["O(log n) 仅出现在 lesson.goals，所有 Beat 的 say 与 close 均未讲解其含义、推导或复杂度；明确核心要求未被实际教授。"]},"progression":{"score":4,"evidence":["setup 先建立数组、下标和边界定义，再进入 trace。","trace/table-header 先说明表格字段，随后按 round-one、round-two 逐轮构建结果。","trace/group-trace 在完成两轮后回顾完整轨迹。"],"concerns":[]},"narration_board_alignment":{"score":4,"evidence":["setup/show-array 的 say 所述数组和下标与 array 表格一致。","trace/round-one 的比较、排除下标 0..3、low=4 均写入 round-one-row，并由 round-one-range 可视化。","trace/round-two 的 low=4、mid=5、high=6、找到下标 5 与 round-two-row、found-result 一致。"],"concerns":[]},"board_use":{"score":4,"evidence":["array 将元素与下标对齐，支撑后续边界讨论。","trace-header、round-one-row、round-two-row 形成结构化逐轮追踪表。","round-one-range 用排除/保留区域呈现范围缩小，found-result 明确标出结果。"],"concerns":[]},"continuous_completion":{"score":4,"evidence":["两轮查找、结果和 close 总结都在单次讲述中完成。","未要求学习者回答、暂停等待或输出测试题。"],"concerns":[]},"context_grounding":{"score":4,"evidence":["Resolved Session Context 仅含空 assets，Lesson 未虚构学习者背景或偏好。","课程以通用的中性讲解组织内容。"],"concerns":[]},"no_unsupported_learner_claims":{"score":4,"evidence":["各 Beat 说明算法状态与推导，未声称学习者已经理解、掌握或存在特定困难。"],"concerns":[]}},"critical_errors":[{"severity":"major","category":"coverage","description":"明确要求的 O(log n) 完全没有在 Beat 的 say、可见 actions 或 close 中教授；目标字段不构成实际覆盖。","evidence":"lesson.goals 含“理解时间复杂度 O(log n)”，但 setup、trace 的全部 say 和 close.summary 只讲两轮查找过程及找到 23。"}],"confidence":"high","limitations":[]}