{"rubric_version":"0.2","case_id":"history-industrial-revolution-001","dimensions":{"correctness":{"score":4,"evidence":["beat-agriculture-population：将农业改良解释为提供粮食、劳动力与市场，而非“直接造出机器”。","beat-resources：准确区分煤提供能源、铁提供机器与设备材料。","beat-factory-system：准确说明工厂制把动力、机器、原料和工人集中，并改变工序、时间与劳动纪律。"],"concerns":[]},"request_coverage":{"score":4,"evidence":["beat-timeline：实际讲授18世纪前期条件积累、机器创新及蒸汽动力与工厂制扩展的时间线。","beat-agriculture-population：实际讲授农业改良、人口增长、劳动力与需求。","beat-resources、beat-capital-market：实际讲授煤铁、资本市场与贸易市场。","beat-multiple-causes：明确说明“不是……任何一个因素单独造成的，而是多种条件……相互加强”。"],"concerns":[]},"progression":{"score":4,"evidence":["step-overview 先提出两个问题并建立时间框架，step-conditions 再分解条件网络。","step-transformation 在条件之后讲蒸汽动力和工厂制的机制。","step-synthesis 通过 beat-multiple-causes 与 beat-final-chain 将前述内容收束为总因果链。"],"concerns":[]},"narration_board_alignment":{"score":4,"evidence":["beat-timeline 的讲述三阶段与 time-conditions、time-machines、time-factories 及连接线一致。","beat-steam 的水力限制、蒸汽机、机器集中运转分别对应 water-limit、steam-power、power-concentration。","beat-factory-system 的生产组织变化对应 domestic-system、factory-system、factory-management、mass-production。","beat-multiple-causes 的多因结论对应 combined-conditions、british-industrialization、not-single-cause。"],"concerns":[]},"board_use":{"score":4,"evidence":["beat-timeline 用横向阶段节点、连接线和 industrial-timeline 分组构成清晰时间线。","step-conditions 按农业人口、煤铁、资本市场分区，并以因果连接组织关系。","beat-factory-system 以旧生产方式→工厂制→管理→大批量生产展示转变链。","beat-final-chain 聚焦 complete-causal-chain 与 not-single-cause，同时保留主线和多因结论。"],"concerns":[]},"continuous_completion":{"score":4,"evidence":["全部 beats 均为连续讲述和板书动作，没有等待学生作答的停顿。","close 提供完整总结，并聚焦时间线、完整因果链和多因结论。"],"concerns":[]},"context_grounding":{"score":4,"evidence":["lesson.adaptation.context_refs 明确引用 learner_request。","adaptation 的“时间线”“多条因果链”“区分条件、突破与变化”直接对应请求的讲解方式。","Resolved Session Context 未提供学习者画像；课程未虚构能力、偏好或背景。"],"concerns":[]},"no_unsupported_learner_claims":{"score":4,"evidence":["全文没有声称学习者已掌握、误解或偏好任何具体内容。","lesson.adaptation 只陈述教学策略，不对学习者作无证据判断。"],"concerns":[]}},"critical_errors":[],"confidence":"high","limitations":[]}