{"rubric_version":"0.2","case_id":"math-fraction-compare-001","dimensions":{"correctness":{"score":4,"evidence":["beat-convert-five-eighths 正确推导 5/8=15/24；beat-convert-seven-twelfths 正确推导 7/12=14/24。","beat-cross-products 正确计算 5×12=60、7×8=56；beat-cross-conclusion 正确说明通分到 96 后为 60/96 与 56/96。"],"concerns":[]},"request_coverage":{"score":4,"evidence":["step-common-denominator 的各 Beat 实际讲解最小公倍数 24、等值改写和同分母比较。","step-cross-multiply 的各 Beat 实际讲解交叉相乘、60 与 56 的比较及其含义。","beat-synthesis 与 close 明确得出 5/8>7/12，且全程未使用小数法。"],"concerns":[]},"progression":{"score":4,"evidence":["从 step-visual 的同长分数条直观比较，逐步过渡到 step-common-denominator 的分步通分，再到 step-cross-multiply 的计算与原理联系。","beat-cross-setup 先说明比较的两个乘积及其意义，beat-cross-products 后才计算，beat-cross-conclusion 最后作结论。"],"concerns":[]},"narration_board_alignment":{"score":4,"evidence":["beat-convert-five-eighths 的说法与 alias convert-five-eighths 均展示分子、分母同乘 3 得 15/24。","beat-cross-products 的说法与 cross-left-product、cross-right-product 均对应 60 和 56。","beat-synthesis 的讲述与 final-conclusion 及两个 connect 动作一致地汇合两种方法。"],"concerns":[]},"board_use":{"score":4,"evidence":["five-eighths-bar 与 seven-twelfths-bar 置于 visual-comparison 区域并 focus，支持同长分数条的视觉比较。","common-method 和 cross-method 分组，分别包含标题、步骤、结果；final-conclusion 位于独立 conclusion 区域并由两种方法连接。"],"concerns":[]},"continuous_completion":{"score":4,"evidence":["lesson.mode 为 explain，所有步骤按连续 Beat 给出完整讲解与结论。","各 Beat 和 close 均未要求学习者回答、暂停等待或完成测试题。"],"concerns":[]},"context_grounding":{"score":4,"evidence":["lesson.adaptation.context_refs 明确引用 learner.preference.visual-fractions。","step-visual 实际先用两条 fraction_bar 讲解，再进入符号计算，和该已提供偏好一致。"],"concerns":[]},"no_unsupported_learner_claims":{"score":4,"evidence":["课程未声称学习者已经掌握、不会或应当能完成任何内容。","对学习者的适配仅使用已给出的 learner.preference.visual-fractions，未扩展为无证据的能力判断。"],"concerns":[]}},"critical_errors":[],"confidence":"high","limitations":[]}